{
  "format_version": "1.0",
  "source_runtime": "agent_skills_std",
  "generation_mode": "auto",
  "user_acknowledged_stubs": false,
  "plan": [
    {
      "entry_id": "dep_001",
      "category": "c1_identity",
      "disposition": "bundle",
      "source_of_decision": "auto",
      "source_elements": ["elem_001"],
      "target": "config.py:SKILL_NAME"
    },
    {
      "entry_id": "dep_002",
      "category": "c1_identity",
      "disposition": "bundle",
      "source_of_decision": "auto",
      "source_elements": ["elem_002"],
      "target": "config.py:SKILL_DESCRIPTION"
    },
    {
      "entry_id": "dep_003",
      "category": "c1_identity",
      "disposition": "bundle",
      "source_of_decision": "auto",
      "source_elements": ["elem_010"],
      "target": "config.py:PREFIX_TEXT"
    },
    {
      "entry_id": "dep_004",
      "category": "c1_identity",
      "disposition": "bundle",
      "source_of_decision": "auto",
      "source_elements": ["elem_023"],
      "target": "config.py:SKILL_VERSION"
    },
    {
      "entry_id": "dep_005",
      "category": "c1_identity",
      "disposition": "bundle",
      "source_of_decision": "auto",
      "source_elements": ["elem_054"],
      "target": "config.py:SKILL_OWNER"
    },
    {
      "entry_id": "dep_006",
      "category": "c2_operating_rules",
      "disposition": "bundle",
      "source_of_decision": "auto",
      "source_elements": ["elem_008", "elem_026"],
      "target": "config.py:SCORE_CRITICAL"
    },
    {
      "entry_id": "dep_007",
      "category": "c2_operating_rules",
      "disposition": "bundle",
      "source_of_decision": "auto",
      "source_elements": ["elem_015", "elem_027", "elem_028"],
      "target": "tools.py:PROMPT_INJECTION_CRITICAL"
    },
    {
      "entry_id": "dep_008",
      "category": "c2_operating_rules",
      "disposition": "bundle",
      "source_of_decision": "auto",
      "source_elements": ["elem_016", "elem_030"],
      "target": "tools.py:CREDENTIAL_EXFIL"
    },
    {
      "entry_id": "dep_009",
      "category": "c2_operating_rules",
      "disposition": "bundle",
      "source_of_decision": "auto",
      "source_elements": ["elem_017", "elem_029"],
      "target": "tools.py:COMMAND_INJECTION"
    },
    {
      "entry_id": "dep_010",
      "category": "c2_operating_rules",
      "disposition": "bundle",
      "source_of_decision": "auto",
      "source_elements": ["elem_018", "elem_031"],
      "target": "tools.py:SSRF_PATTERNS"
    },
    {
      "entry_id": "dep_011",
      "category": "c2_operating_rules",
      "disposition": "bundle",
      "source_of_decision": "auto",
      "source_elements": ["elem_019", "elem_032"],
      "target": "tools.py:PATH_TRAVERSAL"
    },
    {
      "entry_id": "dep_012",
      "category": "c2_operating_rules",
      "disposition": "bundle",
      "source_of_decision": "auto",
      "source_elements": ["elem_021"],
      "target": "config.py:EXCLUDED_PATHS"
    },
    {
      "entry_id": "dep_013",
      "category": "c2_operating_rules",
      "disposition": "bundle",
      "source_of_decision": "auto",
      "source_elements": ["elem_033"],
      "target": "tools.py:SENSITIVE_FILES"
    },
    {
      "entry_id": "dep_014",
      "category": "c2_operating_rules",
      "disposition": "bundle",
      "source_of_decision": "auto",
      "source_elements": ["elem_034"],
      "target": "tools.py:ALLOWED_DOMAINS"
    },
    {
      "entry_id": "dep_015",
      "category": "c6_tools",
      "disposition": "real_impl",
      "source_of_decision": "auto",
      "source_elements": ["elem_007", "elem_045"],
      "target": "tools.py:full_audit",
      "subtype": "sdk",
      "prerequisites": [
        "Bundled script: scripts/clawdefender.sh — resolve via Path(__file__).parent / 'scripts' / 'clawdefender.sh'",
        "Host system: bash, grep, find, stat"
      ]
    },
    {
      "entry_id": "dep_016",
      "category": "c6_tools",
      "disposition": "real_impl",
      "source_of_decision": "auto",
      "source_elements": ["elem_009", "elem_050"],
      "target": "tools.py:sanitize_external_input",
      "subtype": "sdk",
      "prerequisites": [
        "Bundled script: scripts/sanitize.sh — resolve via Path(__file__).parent / 'scripts' / 'sanitize.sh'",
        "Host system: bash"
      ]
    },
    {
      "entry_id": "dep_017",
      "category": "c6_tools",
      "disposition": "real_impl",
      "source_of_decision": "auto",
      "source_elements": ["elem_011"],
      "target": "tools.py:check_url",
      "subtype": "sdk",
      "prerequisites": [
        "Bundled script: scripts/clawdefender.sh — resolve via Path(__file__).parent / 'scripts' / 'clawdefender.sh'"
      ]
    },
    {
      "entry_id": "dep_018",
      "category": "c6_tools",
      "disposition": "real_impl",
      "source_of_decision": "auto",
      "source_elements": ["elem_012"],
      "target": "tools.py:check_prompt",
      "subtype": "sdk",
      "prerequisites": [
        "Bundled script: scripts/clawdefender.sh — resolve via Path(__file__).parent / 'scripts' / 'clawdefender.sh'"
      ]
    },
    {
      "entry_id": "dep_019",
      "category": "c6_tools",
      "disposition": "real_impl",
      "source_of_decision": "auto",
      "source_elements": ["elem_013", "elem_046"],
      "target": "tools.py:safe_install",
      "subtype": "sdk",
      "prerequisites": [
        "Node.js and npm must be installed (for npx)",
        "clawhub CLI accessible via npx: npx clawhub",
        "Bundled script: scripts/clawdefender.sh — resolve via Path(__file__).parent / 'scripts' / 'clawdefender.sh'"
      ]
    },
    {
      "entry_id": "dep_020",
      "category": "c6_tools",
      "disposition": "real_impl",
      "source_of_decision": "auto",
      "source_elements": ["elem_014"],
      "target": "tools.py:validate_text",
      "subtype": "sdk",
      "prerequisites": [
        "Bundled script: scripts/clawdefender.sh — resolve via Path(__file__).parent / 'scripts' / 'clawdefender.sh'"
      ]
    },
    {
      "entry_id": "dep_021",
      "category": "c6_tools",
      "disposition": "real_impl",
      "source_of_decision": "auto",
      "source_elements": ["elem_044"],
      "target": "tools.py:scan_skill_files",
      "subtype": "sdk",
      "prerequisites": [
        "Host system: find command for file discovery",
        "Bundled script: scripts/clawdefender.sh — resolve via Path(__file__).parent / 'scripts' / 'clawdefender.sh'"
      ]
    },
    {
      "entry_id": "dep_022",
      "category": "c8_runtime_environment",
      "disposition": "bundle",
      "source_of_decision": "auto",
      "source_elements": ["elem_005"],
      "target": "config.py:REQUIRED_BINS"
    },
    {
      "entry_id": "dep_023",
      "category": "c8_runtime_environment",
      "disposition": "bundle",
      "source_of_decision": "auto",
      "source_elements": ["elem_025"],
      "target": "config.py:WORKSPACE_DIR"
    }
  ]
}
