{
  "format_version": "1.0",
  "source_runtime": "agent_skills_std",
  "generation_mode": "auto",
  "user_acknowledged_stubs": false,
  "plan": [
    {
      "entry_id": "dep_001",
      "category": "c1_identity",
      "disposition": "bundle",
      "source_of_decision": "auto",
      "source_elements": ["elem_001", "elem_005"],
      "target": "config.py:SKILL_NAME",
      "prerequisites": []
    },
    {
      "entry_id": "dep_002",
      "category": "c2_operating_rules",
      "disposition": "bundle",
      "source_of_decision": "auto",
      "source_elements": ["elem_006"],
      "target": "config.py:OUT_OF_SCOPE_CATEGORIES",
      "prerequisites": []
    },
    {
      "entry_id": "dep_003",
      "category": "c8_runtime_environment",
      "disposition": "bundle",
      "source_of_decision": "auto",
      "source_elements": ["elem_003", "elem_015"],
      "target": "config.py:BACKEND",
      "prerequisites": [
        "curl binary must be installed (from metadata.openclaw.requires.bins)"
      ]
    },
    {
      "entry_id": "dep_004",
      "category": "c6_tools",
      "disposition": "real_impl",
      "source_of_decision": "auto",
      "source_elements": ["elem_008", "elem_009", "elem_010"],
      "target": "tools.py:fetch_weather",
      "subtype": "http",
      "prerequisites": [
        "HTTP access to wttr.in (public, no API key required)",
        "curl binary available on PATH"
      ]
    },
    {
      "entry_id": "dep_005",
      "category": "c6_tools",
      "disposition": "bundle",
      "source_of_decision": "auto",
      "source_elements": ["elem_011", "elem_012", "elem_013", "elem_014"],
      "target": "config.py:WEATHER_FORMAT_CODES",
      "subtype": "http",
      "prerequisites": []
    }
  ]
}
