{
  "format_version": "1.0",
  "source_runtime": "agent_skills_std",
  "generation_mode": "auto",
  "user_acknowledged_stubs": false,
  "plan": [
    {
      "entry_id": "dep_001",
      "category": "c8_runtime_environment",
      "disposition": "bundle",
      "source_of_decision": "auto",
      "source_elements": ["elem_001"],
      "target": "config.py:SKILL_NAME",
      "prerequisites": []
    },
    {
      "entry_id": "dep_002",
      "category": "c6_tools",
      "disposition": "real_impl",
      "source_of_decision": "auto",
      "source_elements": ["elem_004"],
      "target": "main.py:gather_diff",
      "subtype": "abstract",
      "prerequisites": [
        "git CLI installed and available on PATH",
        "gh CLI (GitHub CLI) installed and authenticated",
        "Working directory must be inside a git repository"
      ]
    },
    {
      "entry_id": "dep_003",
      "category": "c6_tools",
      "disposition": "stub",
      "source_of_decision": "auto",
      "source_elements": ["elem_013"],
      "target": "constrained_slots.py:search_fn",
      "subtype": "abstract",
      "prerequisites": []
    },
    {
      "entry_id": "dep_004",
      "category": "c6_tools",
      "disposition": "stub",
      "source_of_decision": "auto",
      "source_elements": ["elem_014"],
      "target": "constrained_slots.py:read_file_fn",
      "subtype": "abstract",
      "prerequisites": []
    }
  ]
}
